{
  "name": "plantuml_web",
  "slug": "2niuhe__plantuml_web",
  "description": "Using nicegui as a PlantUML frontend, you can deploy PlantUML on an intranet.",
  "readme": "# plantuml_web\nUsing nicegui as a PlantUML frontend, you can deploy PlantUML on an intranet.\n\nIt's a nicegui demo project with an added MCP (Model Context Protocol) server that exposes PlantUML functionality to AI assistants.\n\nPlantuml jar version: plantuml-1.2025.3.jar\n\n![demo](https://github.com/2niuhe/plantuml_web/blob/main/demo_img/demo.png)\n\n## Features\n\n### Web Interface\n- Interactive PlantUML editor with live preview\n- Save and load diagrams\n- Responsive UI with resizable panels\n\n### MCP Server\n- Generate PlantUML diagrams in SVG or PNG format\n- Validate PlantUML code with detailed error messages\n\n## Usage:\n\n### With Docker\n\n```shell\ndocker build -t plantuml_web_mcp .\n\n# or pull from dockerhub\n# docker pull  2niuhe/plantuml_web_mcp:latest\n\ndocker run -d -p 8080:8080 -p 8765:8765 plantuml_web_mcp:latest\n```\n\nThen you can access:\n- Web interface: http://127.0.0.1:8080\n- MCP server: http://127.0.0.1:8765/sse\n\n### Without Docker\n\n```shell\npip install -r requirements.txt\nsh start.sh\n```\n\nThe start script will launch:\n1. PlantUML server on port 8000\n2. Web interface on port 8080\n3. MCP server on port 8765\n\n## Connecting to the MCP Server\n\nYou can connect to the MCP server using any MCP client, such as Claude Desktop:\n\n1. Open Claude Desktop\n2. Go to Settings > MCP Servers\n3. Add a new server with the URL: `http://localhost:8765/sse`\n4. Restart Claude Desktop\n\n## Testing the MCP Server\n\nA test client is provided to verify the MCP server functionality:\n\n```shell\npython test_plantuml_mcp.py http://localhost:8765/sse\n```\n\n\n\n## Available MCP Tools\n\n- `generate_plantuml_image`: Generate a diagram image from PlantUML code\n- `validate_plantuml_syntax`: Validate PlantUML code and return validation result\n\n\n### ref\n\n[Home · zauberzeug/nicegui Wiki](https://github.com/zauberzeug/nicegui/wiki)\n\n[How to use nicegui for beginners？ · zauberzeug/nicegui · Discussion #1486](https://github.com/zauberzeug/nicegui/discussions/1486)\n\n[Nicegui example and suggestions · zauberzeug/nicegui · Discussion #1778](https://github.com/zauberzeug/nicegui/discussions/1778)\n\n[NiceGUI](https://nicegui.io/documentation)\n\n[syejing/nicegui-reference-cn: NiceGUI 中文版本文档](https://github.com/syejing/nicegui-reference-cn?tab=readme-ov-file)\n\n[(1) Use NiceGUI to watch images and do it from the COMMAND LINE! - YouTube](https://www.youtube.com/watch?v=eq0k642zQQ8)\n",
  "category": null,
  "qualityScore": 68,
  "githubUrl": "https://github.com/2niuhe/plantuml_web",
  "programmingLanguage": "Python",
  "gitHubOrg": "2niuhe",
  "gitHubRepo": "plantuml_web",
  "repositoryPath": null,
  "gh_stars": 2,
  "gh_contributors": 1,
  "gh_issues": 0,
  "gh_releases": false,
  "gh_ci_cd": false,
  "gh_latest_commit_hash": "d9d482ca87a62e61cbd855706e92e6a3f90f9d47",
  "last_scraped_at": "2025-07-31T20:49:02.758Z",
  "implementing_tools": null,
  "implementing_prompts": null,
  "implementing_resources": null,
  "implementing_sampling": null,
  "implementing_roots": null,
  "implementing_logging": null,
  "implementing_stdio": null,
  "implementing_streamable_http": null,
  "implementing_oauth2": null
}