{
  "dxt_version": "0.1.0",
  "name": "zaizaizhao__mcp-swagger-server",
  "display_name": "swagger",
  "version": "1.0.0",
  "description": "MCP Swagger Server æ˜¯ä¸€ä¸ª Monorepo é¡¹ç›®ï¼Œæ ¸å¿ƒåŠŸèƒ½æ˜¯å°†ä»»ä½•ç¬¦åˆ OpenAPI/Swagger è§„èŒƒçš„ REST API è½¬æ¢ä¸º Model Context Protocol (MCP) æ ¼å¼ï¼Œè®© AI åŠ©æ‰‹èƒ½å¤Ÿç†è§£å’Œè°ƒç”¨æ‚¨çš„ APIã€‚",
  "author": {
    "name": "zaizaizhao"
  },
  "server": {
    "type": "node",
    "entry_point": "index.js",
    "mcp_config": {
      "command": "mcp-swagger-server",
      "args": [
        "--openapi",
        "https://api.example.com/openapi.json",
        "--transport",
        "stdio",
        "--auth-type",
        "bearer",
        "--bearer-env",
        "API_TOKEN"
      ],
      "env": {
        "server-basic": "",
        "server-configured": "",
        "server-docker": ""
      }
    }
  },
  "tools": [],
  "prompts": [],
  "keywords": [],
  "user_config": {},
  "readme": "# MCP Swagger Server ğŸš€\n\n<div align=\"center\">\n\n[![TypeScript](https://img.shields.io/badge/TypeScript-5+-blue.svg)](https://www.typescriptlang.org/)\n[![Node.js](https://img.shields.io/badge/Node.js-16+-green.svg)](https://nodejs.org/)\n[![License](https://img.shields.io/badge/license-MIT-blue.svg)](LICENSE)\n\n**å°† OpenAPI/Swagger è§„èŒƒè½¬æ¢ä¸º Model Context Protocol (MCP) æ ¼å¼çš„æœåŠ¡å™¨**\n\né›¶é…ç½®å°†æ‚¨çš„ REST API è½¬æ¢ä¸º AI å¯è°ƒç”¨çš„å·¥å…·\n\n[ğŸš€ å¿«é€Ÿå¼€å§‹](#å¿«é€Ÿå¼€å§‹) â€¢ [ğŸ“– ä½¿ç”¨æŒ‡å—](#ä½¿ç”¨æŒ‡å—) â€¢ [ğŸ› ï¸ å¼€å‘](#å¼€å‘)\n\n**Languages**: [English](README_EN.md) | ä¸­æ–‡\n\n</div>\n\n---\n\n## ğŸ¯ é¡¹ç›®ç®€ä»‹\n\nMCP Swagger Server æ˜¯ä¸€ä¸ª **Monorepo** é¡¹ç›®ï¼Œæ ¸å¿ƒåŠŸèƒ½æ˜¯å°†ä»»ä½•ç¬¦åˆ OpenAPI/Swagger è§„èŒƒçš„ REST API è½¬æ¢ä¸º Model Context Protocol (MCP) æ ¼å¼ï¼Œè®© AI åŠ©æ‰‹èƒ½å¤Ÿç†è§£å’Œè°ƒç”¨æ‚¨çš„ APIã€‚\n\n### ğŸ“¦ é¡¹ç›®ç»“æ„\n\n```\nmcp-swagger-server/\nâ”œâ”€â”€ packages/\nâ”‚   â”œâ”€â”€ mcp-swagger-server/     # ğŸ”§ æ ¸å¿ƒ MCP æœåŠ¡å™¨ (å¯ç”¨)\nâ”‚   â”œâ”€â”€ mcp-swagger-parser/     # ğŸ“ OpenAPI è§£æå™¨ (å¼€å‘ä¸­)\nâ”‚   â”œâ”€â”€ mcp-swagger-ui/         # ğŸ¨ Web ç•Œé¢ (å¼€å‘ä¸­)\nâ”‚   â””â”€â”€ mcp-swagger-api/        # ğŸ”— REST API åç«¯ (å¼€å‘ä¸­)\nâ””â”€â”€ scripts/                    # ğŸ”¨ æ„å»ºå·¥å…·\n```\n\n### âœ¨ æ ¸å¿ƒç‰¹æ€§\n\n- **ğŸ”„ é›¶é…ç½®è½¬æ¢**: è¾“å…¥ OpenAPI è§„èŒƒï¼Œç«‹å³è·å¾— MCP å·¥å…·\n- **ğŸ¯ AI åŸç”Ÿè®¾è®¡**: ä¸“ä¸º Claudeã€ChatGPT ç­‰ AI åŠ©æ‰‹ä¼˜åŒ–\n- **ğŸ”Œ å¤šä¼ è¾“åè®®**: æ”¯æŒ SSEã€Streamable å’Œ Stdio ä¼ è¾“\n- **ğŸ” å®‰å…¨è®¤è¯**: æ”¯æŒ Bearer Token è®¤è¯ä¿æŠ¤ API è®¿é—®\n- **âš¡ é«˜æ€§èƒ½**: åŸºäº TypeScript æ„å»ºï¼Œæä¾›å®Œæ•´çš„ç±»å‹å®‰å…¨\n\n## ğŸš€ å¿«é€Ÿå¼€å§‹\n\n### ç¯å¢ƒè¦æ±‚\n\n- Node.js â‰¥ 20.0.0\n- pnpm â‰¥ 8.0.0 (æ¨è)\n\n### å®‰è£…\n\n```bash\n# å…‹éš†é¡¹ç›®\ngit clone https://github.com/zaizaizhao/mcp-swagger-server.git\ncd mcp-swagger-server\n\n# å®‰è£…ä¾èµ–\npnpm install\n\n# æ„å»ºé¡¹ç›®\npnpm build\n```\n\n### å¿«é€Ÿå¯åŠ¨\n\n```bash\n# è¿›å…¥ MCP æœåŠ¡å™¨åŒ…ç›®å½•\ncd packages/mcp-swagger-server\n\n# ä½¿ç”¨ Petstore API ç¤ºä¾‹å¯åŠ¨\npnpm cli:petstore\n\n# æˆ–è€…ä½¿ç”¨ GitHub API ç¤ºä¾‹\npnpm cli:github\n```\n\n## ğŸ“– ä½¿ç”¨æŒ‡å—\n\n### ğŸ”§ `mcp-swagger-server` åŒ…\n\nè¿™æ˜¯é¡¹ç›®çš„æ ¸å¿ƒåŒ…ï¼Œæä¾›äº†å®Œæ•´çš„ MCP æœåŠ¡å™¨åŠŸèƒ½ã€‚\n\n#### å®‰è£…å’Œä½¿ç”¨\n\n```bash\n# å…¨å±€å®‰è£…\nnpm install -g mcp-swagger-server\n\n# å‘½ä»¤è¡Œä½¿ç”¨\nmcp-swagger-server --openapi https://petstore.swagger.io/v2/swagger.json --transport streamable --port 3322\n```\n\n#### æ”¯æŒçš„ä¼ è¾“åè®®\n\n- **stdio**: ç”¨äºå‘½ä»¤è¡Œé›†æˆ\n- **sse**: Server-Sent Eventsï¼Œé€‚ç”¨äº Web åº”ç”¨\n- **streamable**: HTTP æµä¼ è¾“ï¼Œé€‚ç”¨äºç°ä»£ Web åº”ç”¨\n\n#### å‘½ä»¤è¡Œé€‰é¡¹\n\n```bash\n# åŸºæœ¬ç”¨æ³•\nmcp-swagger-server [é€‰é¡¹]\n\n# é€‰é¡¹ï¼š\n--openapi, -o       OpenAPI è§„èŒƒçš„ URL æˆ–æ–‡ä»¶è·¯å¾„\n--transport, -t     ä¼ è¾“åè®® (stdio|sse|streamable)\n--port, -p          ç«¯å£å·\n--watch, -w         ç›‘æ§æ–‡ä»¶å˜åŒ–\n--verbose           è¯¦ç»†æ—¥å¿—è¾“å‡º\n\n# Bearer Token è®¤è¯é€‰é¡¹ï¼š\n--auth-type         è®¤è¯ç±»å‹ (bearer)\n--bearer-token      ç›´æ¥æŒ‡å®š Bearer Token\n--bearer-env        ä»ç¯å¢ƒå˜é‡è¯»å– Token\n--config, -c        é…ç½®æ–‡ä»¶è·¯å¾„\n```\n\n#### ç¤ºä¾‹\n\n```bash\n# ä½¿ç”¨æœ¬åœ° OpenAPI æ–‡ä»¶\nmcp-swagger-server --openapi ./swagger.json --transport sse --port 3322\n\n# ä½¿ç”¨è¿œç¨‹ OpenAPI URL\nmcp-swagger-server --openapi https://api.example.com/openapi.json --transport streamable --port 3323\n\n# ç›‘æ§æ–‡ä»¶å˜åŒ–\nmcp-swagger-server --openapi ./api.yaml --transport stdio --watch\n\n# ä½¿ç”¨ Bearer Token è®¤è¯\nmcp-swagger-server --openapi https://api.example.com/openapi.json --auth-type bearer --bearer-token \"your-token-here\" --transport sse --port 3322\n\n# ä»ç¯å¢ƒå˜é‡è¯»å– Token\nexport API_TOKEN=\"your-token-here\"\nmcp-swagger-server --openapi https://api.example.com/openapi.json --auth-type bearer --bearer-env API_TOKEN --transport stdio\n```\n\n### ğŸ” Bearer Token è®¤è¯\n\n`mcp-swagger-server` æ”¯æŒ Bearer Token è®¤è¯ï¼Œå¯ä»¥ä¿æŠ¤éœ€è¦èº«ä»½éªŒè¯çš„ API è®¿é—®ã€‚\n\n#### è®¤è¯æ–¹å¼\n\n**1. ç›´æ¥æŒ‡å®š Token**\n```bash\nmcp-swagger-server --auth-type bearer --bearer-token \"your-token-here\" --openapi https://api.example.com/openapi.json\n```\n\n**2. ç¯å¢ƒå˜é‡æ–¹å¼**\n```bash\n# è®¾ç½®ç¯å¢ƒå˜é‡\nexport API_TOKEN=\"your-token-here\"\n\n# ä½¿ç”¨ç¯å¢ƒå˜é‡\nmcp-swagger-server --auth-type bearer --bearer-env API_TOKEN --openapi https://api.example.com/openapi.json\n```\n\n**3. é…ç½®æ–‡ä»¶æ–¹å¼**\n```json\n{\n  \"transport\": \"sse\",\n  \"port\": 3322,\n  \"openapi\": \"https://api.example.com/openapi.json\",\n  \"auth\": {\n    \"type\": \"bearer\",\n    \"bearer\": {\n      \"token\": \"your-token-here\",\n      \"source\": \"static\"\n    }\n  }\n}\n```\n\n```bash\n# ä½¿ç”¨é…ç½®æ–‡ä»¶\nmcp-swagger-server --config config.json\n```\n\n#### ç¯å¢ƒå˜é‡é…ç½®\n\nåˆ›å»º `.env` æ–‡ä»¶ï¼š\n```env\n# åŸºç¡€é…ç½®\nMCP_PORT=3322\nMCP_TRANSPORT=stdio\nMCP_OPENAPI_URL=https://api.example.com/openapi.json\n\n# è®¤è¯é…ç½®\nMCP_AUTH_TYPE=bearer\nAPI_TOKEN=your-bearer-token-here\n```\n\n### ğŸ¤– ä¸ AI åŠ©æ‰‹é›†æˆ\n\n#### Claude Desktop é…ç½®\n\n```json\n{\n  \"mcpServers\": {\n    \"swagger-converter\": {\n      \"command\": \"mcp-swagger-server\",\n      \"args\": [\n        \"--openapi\", \"https://petstore.swagger.io/v2/swagger.json\",\n        \"--transport\", \"stdio\"\n      ]\n    },\n    \"secured-api\": {\n      \"command\": \"mcp-swagger-server\",\n      \"args\": [\n        \"--openapi\", \"https://api.example.com/openapi.json\",\n        \"--transport\", \"stdio\",\n        \"--auth-type\", \"bearer\",\n        \"--bearer-env\", \"API_TOKEN\"\n      ],\n      \"env\": {\n        \"API_TOKEN\": \"your-bearer-token-here\"\n      }\n    }\n  }\n}\n```\n\n#### ç¼–ç¨‹æ–¹å¼ä½¿ç”¨\n\n```typescript\nimport { createMcpServer } from 'mcp-swagger-server';\n\n// åŸºæœ¬ä½¿ç”¨\nconst server = await createMcpServer({\n  openapi: 'https://api.example.com/openapi.json',\n  transport: 'streamable',\n  port: 3322\n});\n\n// ä½¿ç”¨ Bearer Token è®¤è¯\nconst securedServer = await createMcpServer({\n  openapi: 'https://api.example.com/openapi.json',\n  transport: 'streamable',\n  port: 3322,\n  auth: {\n    type: 'bearer',\n    bearer: {\n      token: 'your-token-here',\n      source: 'static'\n    }\n  }\n});\n\nawait server.start();\n```\n\n## ğŸ› ï¸ å¼€å‘\n\n### æ„å»ºç³»ç»Ÿ\n\n```bash\n# æ„å»ºæ‰€æœ‰åŒ…\npnpm build\n\n# ä»…æ„å»ºåç«¯åŒ…\npnpm build:packages\n\n# å¼€å‘æ¨¡å¼\npnpm dev\n\n# æ¸…ç†æ„å»ºäº§ç‰©\npnpm clean\n```\n\n### æµ‹è¯•å’Œè°ƒè¯•\n\n```bash\n# è¿è¡Œæµ‹è¯•\npnpm test\n\n# ä»£ç æ£€æŸ¥\npnpm lint\n\n# ç±»å‹æ£€æŸ¥\npnpm type-check\n\n# é¡¹ç›®å¥åº·æ£€æŸ¥\npnpm diagnostic\n```\n\n### å¼€å‘ MCP æœåŠ¡å™¨\n\n```bash\ncd packages/mcp-swagger-server\n\n# å¼€å‘æ¨¡å¼å¯åŠ¨\npnpm dev\n\n# è¿è¡Œ CLI å·¥å…·\npnpm cli --help\n\n```\n\n## ğŸ“‹ é¡¹ç›®çŠ¶æ€\n\n| åŒ… | çŠ¶æ€ | æè¿° |\n|---|---|---|\n| `mcp-swagger-server` | âœ… å¯ç”¨ | æ ¸å¿ƒ MCP æœåŠ¡å™¨ï¼Œæ”¯æŒå¤šç§ä¼ è¾“åè®® |\n| `mcp-swagger-parser` | ğŸš§ å¼€å‘ä¸­ | OpenAPI è§£æå™¨å’Œè½¬æ¢å·¥å…· |\n| `mcp-swagger-ui` | ğŸš§ å¼€å‘ä¸­ | Vue.js Web ç•Œé¢ |\n| `mcp-swagger-api` | ğŸš§ å¼€å‘ä¸­ | NestJS REST API åç«¯ |\n\n## ğŸ¤ è´¡çŒ®\n\næ¬¢è¿è´¡çŒ®ï¼è¯·å…ˆé˜…è¯» [è´¡çŒ®æŒ‡å—](CONTRIBUTING.md)ã€‚\n\n## ğŸ“„ è®¸å¯è¯\n\nMIT License - è¯¦è§ [LICENSE](LICENSE) æ–‡ä»¶ã€‚\n\n---\n\n<div align=\"center\">\n\n**Built with â¤ï¸ by ZhaoYaNan(ZTE)**\n\n[â­ Star](../../stargazers) â€¢ [ğŸ› Issues](../../issues) â€¢ [ğŸ’¬ Discussions](../../discussions)\n\n</div>",
  "category": "AI Tools",
  "quality_score": 44,
  "config_for_archestra": {
    "oauth": {
      "provider": "none",
      "required": false
    }
  },
  "github_info": {
    "owner": "zaizaizhao",
    "repo": "mcp-swagger-server",
    "url": "https://github.com/zaizaizhao/mcp-swagger-server",
    "name": "mcp-swagger-server",
    "path": null,
    "stars": 11,
    "contributors": 1,
    "issues": 2,
    "releases": false,
    "ci_cd": false,
    "latest_commit_hash": "813d931dd6c2f5c4ea1a93d2da2180eab0e97842"
  },
  "programming_language": "TypeScript",
  "framework": null,
  "last_scraped_at": "2025-08-04T09:36:34.708Z",
  "evaluation_model": "gemini-2.5-flash",
  "protocol_features": {
    "implementing_tools": true,
    "implementing_prompts": false,
    "implementing_resources": false,
    "implementing_sampling": false,
    "implementing_roots": false,
    "implementing_logging": true,
    "implementing_stdio": true,
    "implementing_streamable_http": true,
    "implementing_oauth2": false
  },
  "dependencies": [],
  "raw_dependencies": "=== package.json ===\n{\n  \"name\": \"mcp-swagger-monorepo\",\n  \"version\": \"1.0.0\",\n  \"description\": \"MCP Swagger Server - A comprehensive monorepo for OpenAPI/Swagger to MCP conversion\",\n  \"private\": true,\n  \"scripts\": {\n    \"build\": \"node scripts/build.js\",\n    \"build:packages\": \"node scripts/build.js --non-ui\",\n    \"prepack\": \"node scripts/build.js\",\n    \"pack\": \"pnpm pack --filter mcp-swagger-server && pnpm pack --filter mcp-swagger-parser\",\n    \"publish\":\"pnpm publish --filter mcp-swagger-server && pnpm publish --filter mcp-swagger-parser\",\n    \"dev\": \"node scripts/dev.js\",\n    \"dev:ui\": \"pnpm --filter=mcp-swagger-ui run dev\",\n    \"clean\": \"node scripts/clean.js\",\n    \"clean:build\": \"node scripts/clean.js --build-only\",\n    \"diagnostic\": \"node scripts/diagnostic.js\",\n    \"test\": \"pnpm -r run test\",\n    \"lint\": \"pnpm -r run lint\",\n    \"type-check\": \"pnpm -r run type-check\"\n  },\n  \"keywords\": [\n    \"mcp\",\n    \"swagger\",\n    \"openapi\",\n    \"monorepo\",\n    \"model-context-protocol\"\n  ],\n  \"author\": \"\",\n  \"license\": \"MIT\",\n  \"devDependencies\": {\n    \"@changesets/changelog-github\": \"^0.5.1\",\n    \"@changesets/cli\": \"^2.29.5\",\n    \"@types/node\": \"^22.15.21\",\n    \"cross-env\": \"^7.0.3\",\n    \"nodemon\": \"^3.1.10\",\n    \"rimraf\": \"^5.0.5\",\n    \"ts-node\": \"^10.9.2\",\n    \"tsconfig-paths\": \"^4.2.0\",\n    \"tslib\": \"^2.8.1\",\n    \"typescript\": \"^5.8.3\"\n  }\n}\n"
}
